340,"Изысканный и женственный, нежный и кокетливый, легкий и романтичный – все это об аромате LALIQUE Azalee. В его композиции свежие цитрусовые и сладкие фруктовые ноты создают восхитительную основу для утонченного цветочного аккорда, на смену которому приходит теплая чувственность пачули, сандала и мускуса.","Аромат LALIQUE Azalee облачен в стильный флакон, украшенный витиеватыми флористическими узорами.","Роза, бергамот, пачули, гардения, жасмин, мускус, сандал, персик, фрезия.","Изысканный, кокетливый, женственный.",Яркий цветочный.,/common/img/uploaded/productImageFolder/LLQS1220LLG.jpg
341,"Очарование молодости и беззаботности сокрыто в ярком и соблазнительном аромате BRITNEY SPEARS Fantasy Anniversary Edition. Он создан привлекать внимание и очаровывать. Его композиция соткана из искрящихся нот киви, айвы и личи; нежных нот орхидеи и жасмина; чувственных нот ириса и мускуса, дополненных изысканной сладостью белого шоколада.","Орхидея, древесный аккорд, ирис, жасмин, айва, киви, мускус, белый шоколад, личи.","Соблазнительный, кокетливый, яркий.",Яркий цветочный.,/common/img/uploaded/productImageFolder/BSPF40003LG.jpg
342,"O de L'Orangerie приглашает Вас в волшебный сад, в самом начале весны. Подобный чудесной мечте, тонкий свежий аромат, который ассоциируется с тайнами великолепного цветка апельсинового дерева.

Аромат представлен в современной и более совершенной версии исторического флакона, который по-прежнему украшен «завитками» оригинального дизайна, напоминающими круги на воде. Прозрачность стекла дает возможность аромату выразить себя: 
бледно-зеленый цвет того же нежного оттенка, что и середина цветка апельсинового дерева.","Водный аккорд, жасмин, ладан, бергамот, цветок апельсинового дерева, померанец.","Свежий, нежный, цитрусовый.",/common/img/uploaded/productImageFolder/KLM323000LG.jpg
343,"Первое приглашение к путешествию по новой парфюмерной одиссее Dior – коллекции Croisiere. Новое направление в семье ароматов – ежегодно пополняемая коллекция Croisiere. Christian Dior отправляется в ароматное путешествие по Италии, где окружающая красота становится источником вдохновения для парфюмера Франсуа Демаши. Легкое и беспечное путешествие по Средиземноморью. Дом Dior решил сделать остановку в Портофино, в городе, столь дорогом сердцу великого Кутюрье. Выбор был очевидным, настолько силен шарм этого маленького, но элегантного городка. Сегодня Франсуа Демаши решил интерпретировать классическую, никогда не выходящую из моды свежесть одеколона, расставив в ней более женственные аккорды.","Именно в Италии Dior нашел драгоценные компоненты для своего нового аромата: Калабрийский Бергамот, Итальянский Цитрон и Сицилийский Мандарин.","Цитрон, горький миндаль, цветок апельсина.","Спонтанный, соблазнительный, уникальный.",Свежий цитрусовый.,/common/img/uploaded/product/big/2009/11/11/F06512380.jpg
344,"Продолжая развивать свой концепт L’Art du Parfum, EISENBERG приглашает Вас в сенсорное путешествие в самое сердце чувственности, предлагая новую коллекцию ароматов в их самой законченной и престижной форме – L’EXTRAIT (концентрированные духи).","I Am L'Extrait - аромат, преисполненный достоинства, верхние ноты раскрываются нежностью малины, роскошный букет магнолии и черного перца представлен в самом сердце, завершают аромат ноты сандалового дерева иамбры, чтобы навсегда запечатлеться в вашей памяти.","Бергамот, магнолия, амбра, ветивер, мускус, малина, апельсин, сандаловое дерево, черный перец.",/common/img/uploaded/productImageFolder/JSE015286LG.jpg
345,"Яркая и жизнерадостная композиция аромата представляет собой гармоничное сочетание фруктовых, цветочных и древесно-пряных нот. В каждом аккорде JOHN RICHMOND John Richmond Eau de Parfum звучит гимн чувственности и женственности. Он создан для веселых и уверенных в себе современных красавиц, которым нравится познавать мир, каждый день открывая для себя что-то новое. Для тех, кто всеми силами стремится раскрыть свой потенциал и никогда не останавливается на достигнутом.","Лилия, пачули, груша, магнолия, амбра, сандал, нарцисс, ежевика, грейпфрут.","Женственный, жизнерадостный, яркий.",Цветочный фруктовый.,/common/img/uploaded/productImageFolder/JRM200030LG.jpg
346,"Изысканный и соблазнительный ESCADA Especially Escada Elixir создан для смелой и элегантной современной леди. Центр его композиции – благородная нота турецкой розы, раскрывающаяся в окружении свежего фруктового, чувственного древесного и теплого пряного аккордов. В этом аромате идеально сочетаются таинственность, роскошь и кокетство. ESCADA Especially Escada Elixir станет верным спутником тех, кто уверен в себе и умеет каждый миг жизни встречать с улыбкой.","Иланг-иланг, роза, амбретта, древесный аккорд, пачули, груша, чернослив, амбра, мускус, ваниль, слива, грейпфрут.","Соблазнительный, нежный, легкий.",Цветочно-восточный.,/common/img/uploaded/productImageFolder/ESC437008LG.jpg
347,"Композиция COMME DES GARCONS Blue Santal привлекает внимание своей чарующей чувственностью и глубиной, которые гармонично сочетаются с легкостью и кокетливостью звучания. Внимание! Он нравится и мужчинам, и женщинам!","Можжевельник, сандал, сосна, черный перец.","Стильный, современный, чувственный.",Восточно-древесный.,/common/img/uploaded/productImageFolder/CDG084894LG.jpg
348,"Аромат бергамота и вишни, жасмина и дикой розы, кедра и сандала, он создан для яркой, целеустремленной и динамичной современной женщины. Чарующий, пленительный и элегантный Luluforever идеально вписывается в образ независимой красавицы, обладающей неповторимым стилем и интересующейся модными тенденциями.","Бергамот, жасмин, вишня, шиповник, ананас, сандал, кедр, белый мускус.","Динамичный, яркий, чарующий.",Яркий цветочный.,/common/img/uploaded/product/big/2009/02/20/LULCAT023.jpg
349,"Естественная красота и очарование природы воплотились в свежем и изящном аромате GIORGIO ARMANI Acqua Di Gioia Eau Fraiche. На его создание парфюмеров вдохновила соблазнительная прохлада морского бриза. Композиция аромата соткана из цитрусовых, цветочных и акватических нот. Чувственность дарят ноты кедра и мускуса.","Иланг-иланг, жасмин, лимон, коричневый сахар, мандарин, мускус, акватический аккорд, зеленый чай, кедр, грейпфрут.","Женственный, свежий, изящный.",Свежий акватический.,/common/img/uploaded/productImageFolder/EC4092400LG.jpg
350,"Аромат грез и фантазий – BRITNEY SPEARS Island Fantasy – покоряет легкостью и соблазнительностью своего звучания и увлекает за собой в волшебный мир лета. Композиция аромата открывается роскошным и многогранным цитрусовым аккордом. Его дополняют сочные ягодные ноты, на фоне которых «рождается» нежное цветочное «сердце». И завершает картину сладкая нота сахара и чувственная нота мускуса.","Арбуз, клементин, мандарин, жасмин, цитрусовый аккорд, мускус, фиалка, красные ягоды, сахар, фрезия.","Соблазнительный, женственный, романтичный.",Яркий цветочный.,/common/img/uploaded/productImageFolder/BSPI40002LG.jpg
351,"Легкий, свежий и изящный женский аромат ELIZABETH ARDEN Green Tea Honeysuckle создан на основе многогранной и неординарной композиции. Традиционная нота зеленого чая тут дополнена восхитительным цитрусовым аккордом и роскошным цветочным, в котором ярко звучит сладкая нота жимолости. ELIZABETH ARDEN Green Tea Honeysuckle – отличный способ хотя бы на время «вынырнуть» из водоворота дел и забот, чтобы насладиться красотой и гармонией окружающего мира.","Иланг-иланг, бергамот, береза, нероли, лимон, мускус, зеленый чай, ежевика, жимолость, жасмин, мандарин, амбра, персик.","Свежий, легкий, изящный.",Яркий цветочный.,/common/img/uploaded/productImageFolder/ARDHS0001LG.jpg
352,"MOSCHINO Light Clouds полон чувств и эмоций. Его композиция просто покоряет многообразием нот, звучащих при этом невероятно гармонично и женственно. Изысканный цветочный букет дарит аромату нежность, в то время как древесный аккорд наполняет его бархатистой глубиной и чарующей чувственностью. Обладательница MOSCHINO Light Clouds полна энергии и оптимизма. Она романтична и прекрасна. Она умеет ценить каждое мгновение жизни и наслаждаться им.","Роза, зеленый аккорд, цикламен, жасмин, амбра, мускус, ваниль, цветок персика, лотос.","Эмоциональный, динамичный, чувственный.",Цветочный древесный мускусный.,/common/img/uploaded/productImageFolder/MOS006F32LG.jpg
353,"Истинной женственностью и соблазнительной нежностью наполнена композиция элегантного и изысканного VERSACE Pour Femme. Звучание аромата покоряет своей легкостью и аристократизмом. VERSACE Pour Femme изящен и прекрасен. Он подобен кристально чистым каплям росы на лепестках едва распустившегося цветка орхидеи или лотоса, жасмина или азалии. Теплый, бархатистый древесный аккорд и нота мускуса дарят аромату невероятную глубину, делают его звучание еще более чарующим и чувственным.","Орхидея, древесный аккорд, роса, жасмин, мускус, гуава, кедр.","Изысканный, женственный, нежный.",Классический цветочный.,/common/img/uploaded/productImageFolder/VER700030LG.jpg
354,"Соблазнительный и дерзкий BRUNO BANANI Dangerous Woman создан покорять и очаровывать. Нота черной смородины дарит аромату яркость. Цветочный аккорд наполняет его нежностью и романтичностью, ваниль и кокос привносят приятную сладость. Композиция BRUNO BANANI Dangerous Woman отличается восхитительным сочетанием элегантности и неординарности, кокетливости и чувственности.","Кокос, гелиотроп, черная смородина, ваниль, цветочный аккорд.","Женственный, дерзкий, соблазнительный.",Цветочно-восточный.,/common/img/uploaded/productImageFolder/BRU432539LG.jpg
355,"Туалетная вода Miss Dior, очаровательная и искристая – это яркий цветочный шипровый аромат с дыханием весны. Верхние ноты звучат красным апельсином, придающим аромату свежесть и сверкание, за ними следуют элегантные ноты сердца, где переплетены эссенция нероли из Туниса, турецкой и болгарской роз. Знак шипровых ароматов – индонезийские пачули – придают этой излучающей радость туалетной воде насыщенность.","Пачули, апельсин, цветок апельсина.","Искрящийся, радостный, сверкающий.",Шипровые.,/common/img/uploaded/productImageFolder/F06244309LG.jpg
356,"Элегантный, чувственный, таинственный и эротичный аромат.","Три ноты подчёркивают мускусное сердце аромата - цветочно-фруктовая, амбровая и древесная.",Нежную розовую сердцевину флакона обрамляет утолщённое кристально-прозрачное стекло. Коробка глубокого чёрного цвета.,Шипровые.,/common/img/uploaded/productImageFolder/UEZ890125LG.jpg
357,"Каждая девушка должна попробовать этот аромат, на создание которого вдохновила восхитительная и уносящая вспять вселенная конфет.","Это эксперимент с очень сладкими ароматами в стиле sugar high, предназначенный для девушек, которые ищут новые оттенки запахов.","И новая сказка, созданная под вдохновением от приключений Алисы в Стране чудес и Гензеля и Гретель, которые следуют изгибам заколдованного лабиринта.","Les delices de Nina - аромат для гурманов, в котором соединились вступительные тающие и кисловатые ноты свежести и празднество цвета и цитрусовых нот.","Центральная нота представлена сочетанием эксклюзивного восхитительного вкуса клубничных конфет с тонким и ярким ароматом гардении. В глубине аромата таится штрих пралине и ласкающий оттенок белого мускуса, создающий ощущение соблазнительной сладости.","Пралине, гардения, мускус, клубника, цитрус.","Сладкий, эмоциональный, восхитительный.",/common/img/uploaded/productImageFolder/NNR096290LG.jpg
358,"Легкий и изящный VAN CLEEF Reve Enchante подобен таинственному эликсиру из волшебных сказок. Благодаря восхитительному сочетанию цветочного и древесного аккордов, согретых нотами белой амбры и мускуса, его композиция звучит удивительно женственно, нежно и соблазнительно. Мелодия VAN CLEEF Reve Enchante увлекает за собой в мир грез и фантазий, где нет ничего не возможного. Создатели аромата рекомендуют использовать его для особенных, памятных и незабываемых дней.","Клементин, нероли, древесный аккорд, жасмин, амбра, мускус, груша, цветок персика, ландыш.","Женственный, легкий, изящный.",Яркий цветочный.,/common/img/uploaded/productImageFolder/VCA013E02LG.jpg
359,Создатели Paradise Bay черпали вдохновение в первых ароматах Карла Лагерфельда. Их новые произведения исполнены свежести и энергии.,"Женский аромат Paradise Bay обогатился фруктовыми нотами: личи и ананас добавляют искристость бархатистому персику. Яркие ноты «сердца»: жасмин, роза и магнолия, – почти осязаемы. В ласкающем «шлейфе» соединились ваниль, мускус и сандал. Женственная и яркая, новая парфюмерная вода напоминает легкую и в то же время чувственную вуаль.","Ананас, роза, личи, жасмин, магнолия, сандал, мускус, ваниль, персик.","Чувственный, яркий, искристый.",Цветочно-зеленый.,/common/img/uploaded/productImageFolder/KLF002E02LG.jpg
360,"Clinique Aromatics in White — аромат, созданный специально для женщины, которая хочет найти свой индивидуальный запах, позволяющий ей выделиться.","Clinique Aromatics in White открывается смелой, бодрящей волной свежих фиалковых листьев в сочетании с амбровым аккордом ладанника и сычуаньского перца, которые моментально вовлекают вас в сердце аромата.","Средние ноты аромата сосредоточены вокруг прозрачных розовых лепестков розовой воды в сочетании с сочным цветком апельсина и насыщенным аккордом пачули, что создает гармоничное сочетание цветов, запахов и текстур.","Нижние ноты передают загадочный, соблазнительный слой этого аромата с помощью серой амбры и кожного мускуса, а также обладающего притягательной силой бензоина.","Эта комбинация создает чувственный, пьянящий шлейф с несомненным магнетизмом для женщины, которая предпочитает классический, но в то же время индивидуальный аромат.","Бензоин, ладанник, фиалка, пачули, перец, амбра, мускус, цветок апельсина.","Смелый, бодрящий, индивидуальный.",/common/img/uploaded/productImageFolder/CLQZ9F701LG.jpg
361,"В этом спрее для дамской сумочки с запасным блоком, дизайн которого отражает дух Высокой Моды, воплощен особый характер аромата Miss Dior Blooming Bouquet, для создания безусловно женственного, глубоко чувственного образа.",/common/img/uploaded/productImageFolder/F08226082LG.jpg
362,"Вызывающе соблазнительный аромат от известной поп-дивы, Red Sin, с его сладковатой и насыщенной композицией, призван очаровывать и покорять мужские сердца. Парфюм Red Sin, как и стильное, сексуальное красное платье, несомненно, станет центром притяжения всеобщего внимания.","Имбирь, мускус, сандал, корица, цикламен, красное яблоко.","Провокационный, яркий, женственный.",Яркий цветочный.,/common/img/uploaded/productImageFolder/AGI181867LG.jpg
363,"Легкая и воздушная композиция ESCADA Especially Escada Delicate Notes навевает мечты о солнечной весне и нежных, еще только распускающихся цветах. Аромат, сотканный из фруктовых, цветочных и древесных нот, наполняет свою обладательницу оптимизмом, а его изящное звучание очаровывает и дарит хорошее настроение. ESCADA Especially Escada Delicate Notes – воплощение беззаботной юности, символ радости и счастья.","Иланг-иланг, роза, древесный аккорд, груша, амбра, мускус, грейпфрут.","Воздушный, нежный, легкий.",Классический цветочный.,/common/img/uploaded/productImageFolder/ESC430000LG.jpg
