244,"Элегантный женский аромат TRUSSARDI My Name затрагивает самые чувствительные струны души своей обладательницы, раскрывает ее внутреннюю свободу и самые заветные желания. Его имя выражает яркую индивидуальность каждой женщины и ее взаимоотношения с миром, соблюдая при этом деликатную грань между принадлежностью к общему наследию и своими индивидуальными качествами. Аромат уникален и всеобъемлющ одновременно. Его лаконичная композиция чарует многогранностью оттенков своего звучания. Флакон TRUSSARDI My Name является выражением женственности в ее самом глубинном понимании.","Фиалка, гелиотроп, мускус, ваниль, сирень.","Элегантный, женственный, классический.",Классический цветочный.,/common/img/uploaded/productImageFolder/TRU_85002LG.jpg
245,"Элегантное трио ароматов LULU CASTAGNETTE Les Secrets de Lulu создана для молодой модницы, прекрасной горожанки, которая любит уютные рестораны и неспешные прогулки. Она поклонница тонких, изысканных блюд. Она умеет наслаждаться каждым мгновением жизни. А ароматы LULU CASTAGNETTE Les Secrets de Lulu увлекают ее за собой в самое сердце Парижа – города, где сбываются все фантазии…",Аромат LULU CASTAGNETTE Les Secrets de Lulu Les Delices предлагает ранним утром поддаться искушению и насладиться прекрасными завтраком на площади Мадлен.,"Цедра лимона, лимон, амбра, мускус, ваниль, зеленый чай, пион, грейпфрут.","Соблазнительный, женственный, роскошный.",Нежный цветочный.,/common/img/uploaded/productImageFolder/LULCAT069LG.jpg
246,"Нежный, женственный и романтичный аромат Love in Paris от Nina Ricci посвящен самому волшебному чувству — любви. И, конечно же, самому волшебному городу — Парижу. Love in Paris подобен красивой сказке, которая может произойти с каждым, кто в нее верит. В основе композиции аромата — цветочный аккорд, представленный нотами розы и пиона.","Роза, пион, ваниль, бергамот, анис, мускус.","Женственный, романтичный, роскошный.",Нежный цветочный.,/common/img/uploaded/productImageFolder/NNR0E1907LG.jpg
247,Одновременно свежий и чувственный аромат Ange ou Demon Le Secret в версии туалетной воды стал еще более привлекательным. Туалетная вода вторит нотам классического аромата Ange ou Demon Le Secret и раскрывает новые неожиданные грани звучания привычного и столь любимого Le Secret.,"Яблоко, роза, бергамот, пачули, жасмин, лимон, амбра, мускус.","Привлекательный, чувственный, чистый.",Цветочно-фруктовый.,/common/img/products/GIV037486.jpg
248,"Сочетание дерзости, чувственности и роскоши идеально отражает настроение современной женщины. Аромат Emporio Armani Diamonds подчеркнет Вашу силу и уверенность в себе, но вместе с тем сделает Ваш образ более нежным и женственным. Легкость и очарование Emporio Armani Diamonds созданы свежими нотами малины и личи, кокетливостью розы, фрезии и ландыша, сладостью ванили и пряным аккордом пачули.","Личи, малина, роза, фрезия, ландыш, ветивер, кедр, пачули, ваниль.","Уверенный, чарующий, роскошный.",Яркий цветочный.,/common/img/uploaded/product/big/2008/02/04/EC8118500-0.jpg
249,"Кокетливый и соблазнительный MOSCHINO Funny подобен солнечному свету, мгновенно наполняющему все вокруг радостью и оптимизмом. Аромат создан для юных, веселых и беззаботных, красавиц. Для девушек, которые верят в сказки и чудеса. Для тех, кто знает, что в этом мире возможно все – и любая мечта станет реальностью, стоит только очень сильно этого захотеть. Композиция встречает нас восхитительным коктейлем из цитрусово-ягодных нот, на фоне которых раскрывается волшебная мелодия цветочного аккорда.","Жасмин, красная смородина, амбра, розовый перец, мускус, горький апельсин, зеленый чай, кедр, пион.","Соблазнительный, кокетливый, юный.",Цитрусовый цветочный древесный.,/common/img/uploaded/productImageFolder/MOS006C32LG.jpg
250,"Воплощение истинной роскоши и элегантности – аромат VERSACE Yellow Diamond всегда находится в центре внимания. Как и положено драгоценному камню, он очаровывает и восхищает. Продуманная до мелочей композиция VERSACE Yellow Diamond звучит гармонично и благородно. В ней нет ни одной лишней ноты, а каждое сочетание оттенков покоряет своей красотой и чувственностью. Аромат облачен в роскошный, виртуозно выполненный флакон изящного, солнечного оттенка.","Нероли, древесный аккорд, груша, амбра, бергамот, мускус, цитрусовый аккорд, цветок апельсина, фрезия.","Элегантный, роскошный, аристократичный.",Цветочный фруктовый древесный.,/common/img/uploaded/productImageFolder/VER520030LG.jpg
251,"ED HARDY Ed Hardy for Women – аромат с уникальным характером, в котором гармонично сочетается кокетливая застенчивость и уверенность в себе. Многогранная композиция соблазняет и очаровывает. В ее мелодии Вы найдете и экзотический тропический аккорд, и сочные ягодные ноты, и искрящуюся цитрусовую свежесть, и нежность цветочных нот, согретых чувственными амброй и мускусом. ED HARDY Ed Hardy for Women создан для таких же ярких и чувственных современных красавиц.","Манго, земляника, красный грейпфрут, роза, ландыш, фрезия, теплая амбра, мускус.","Яркий, чувственный, женственный.",Яркий цветочный.,/common/img/uploaded/productImageFolder/EDHEHWF04LG.jpg
252,"Характер ED HARDY Hearts & Daggers for Women полон очарования и дерзости, кокетливости и уверенности в себе. Женщина, выбирающая этот аромат, знает, чего хочет от жизни, и всегда получает желаемое. Она умеет очаровывать и покорять сердца. Композиция аромата, сотканная из фруктовых и цветочных нот, оттененных амброй и мускусом, идеально подчеркивает природное обаяние и красоту своей обладательницы.","Апельсин королек, листья фиалки, яблоко, манго, цветок яблони, розовый жасмин, мускус, амбра, бензоин, кашмеран.","Соблазнительный, женственный, дерзкий.",Классический цветочный.,/common/img/uploaded/productImageFolder/EDHHDWF01LG.jpg
253,"Дом Guerlain представляет дерзкий и соблазнительный аромат La Petite Robe Noire в новой версии парфюмерной воды! Искрящийся, страстный и в то же время необыкновенно изысканный, он оставляет безупречный, притягательный шлейф, который непременно сведет с ума любого мужчину… Юная, понятная розовая нота в сочетании с нотами черной черешни - магическая ольфактивная мелодия! Бергамот обеспечивает чувственность, а драгоценный союз свежих и ярких абсолю болгарской и турецкой розы, как сочный рахат-лукум и вкусные цукаты - никого не оставят равнодушным! Чёрная нота – богатая и глубокая, шикарная, благородная и притягательная, открывает темные соблазны пачули, лакричника, бобов тонка и дымного черного чая Лапсанг. Неподражаемая Герлинада придаёт аромату таинственную харизму.","Роза, черешня, пачули, бергамот, цукаты, чай, лакричник, бобы тонка.","Изысканный, страстный, таинственный.",Цветочно-фруктовый.,/common/img/uploaded/productImageFolder/GUE011469LG.jpg
254,Описание отсутствует,/common/img/uploaded/productImageFolder/ELOR46787LG.jpg
255,"BOSS Nuit Pour Femme подобен «маленькому черному платью», в котором нет ничего лишнего и которое идеально подчеркивает элегантность, чувственность и женственность своей обладательницы. Композиция аромата соткана из нежных цветочных нот жасмина, фиалки и белых цветов; дополнена сладостью сочного, спелого персика и согрета бархатистым теплом древесных нот сандала и мха.","Жасмин, альдегид, сандал, фиалка, персик, мох, белые цветы.","Женственный, элегантный, изящный.",Классический цветочный.,/common/img/uploaded/productImageFolder/HBS428876LG.jpg
256,"VERSACE Yellow Diamond Intense также восхитителен, как лучи южного солнца, скользящие по Вашей коже. И также роскошен, как самое изысканное украшение. Он создан для ярких и уверенных в себе женщин. Для тех, кто умеет ценить каждое мгновение жизни и с удовольствием наслаждается всем тем прекрасным, что она дарит.","Нероли, гваяковое дерево, груша, жасмин, амбра, бергамот, мускус, османтус, цветок апельсина, цитрон, фрезия.","Соблазнительный, сияющий, яркий.",Яркий цветочный.,/common/img/uploaded/productImageFolder/VER521030LG.jpg
257,"Представляем туалетную воду Burberry Body. Это новая, более легкая версия культового аромата Burberry Body. Сочетание изысканных ингредиентов, легких и чистых, в том числе новые ноты: хрустящее зеленое яблоко и соблазнительный чай. Женственный и естественно чувственный аромат, нежное воплощение образа и настроения девушки Burberry.","Роза, кашмеран, амбра, мускус, сандал, ваниль, чай, персик, абсент, зеленое яблоко.","Соблазнительный, женственный, элегантный.",Цветочно-фруктовый.,/common/img/uploaded/productImageFolder/EBUR14A07LG.jpg
258,"Заманчивый, загадочный и соблазнительный аромат с непревзойденным характером. Аромат последовательно повествует о словосочетания Femme Fatale. Дерзкие и соблазнительные верхние ноты представлены восхитительным коктейлем пряного мадагаскарского розового перца, противопоставленным сочному манго и экзотической черной смородине, создающей невероятно таинственную, сверкающую прелюдию. 
Сладострастное цветочное сердце соблазняет женственной, небесной гарденией, оттененной элегантной, древесной, фиалковой нотой абсолю ириса и сладким, мрачным, изысканным аккордом листьев пачули. Соблазнительная база знойного, чувственного мускуса, кремовой ванильной орхидеи, шоколада и кожаного испанского ладанника, создает насыщенный, глубокий, влекущий шлейф.

Создатель: Жан-Марк Шайон, парфюмерный дом IFF, Нью-Йорк","Ладанник, орхидея, шоколад, пачули, ирис, гардения, манго, мускус, черная смородина, розовый перец.","Соблазнительный, сексуальный, роскошный.",Яркий цветочный.,/common/img/uploaded/productImageFolder/085715730503LG.jpg
259,Квинтессенция загадочности и чувственности в аромате от Giorgio Armani Code Femme Ultimate.,"Верхние ноты: горький апельсин, имбирь, грушевый сорбет.","Основные ноты: Манящая композиция цветов апельсина, жасмина и кофе.",Соблазнительный ванильный шлейф делает этот аромат невероятно притягательным.,"Имбирь, груша, жасмин, апельсин, ваниль, кофе, цветок апельсина.","Чувственный, притягательный, загадочный.",/common/img/uploaded/productImageFolder/EC4888900LG.jpg
260,Подчеркнуто изящная тубероза распускается в увертюре из молодых листьев фиалки и мягкого персика. База из ладанника и белой древесины кедра добавляет аромату шарма и роскоши.,"В Gracious Tuberose собрано все очарование цветка: его свежие побеги; лепестки, покрытые росой; нежный аромат, окружающий соцветия словно сияющая аура.","Женщина Gracious Tuberose отличается удивительным душевным спокойствием. Она порхает по жизни в танце, словно балерина, даря радость всем, кто находится рядом.","Листья фиалки, персик, тубероза, цветок апельсина, роза, ладанник (каменная роза), белый кедр.",Харизматичный. Грациозный. Радостный.,Классический цветочный.,/common/img/products/GUC427276.jpg
261,"Элегантный и соблазнительный Sheer Beauty создан подчеркнуть природную красоту и очарование каждой своей обладательницы. В композиции аромата гармонично сочетаются нежные цветочные, яркие фруктовые и чувственные древесные мотивы. Sheer Beauty полон радости и оптимизма, сотканных из нот жасмина, пиона, лилии, ванили, бергамота, сандала и мускуса.","Бергамот, красная смородина, коктейль беллини, жасмин, пион, лилия, ваниль, сандал, мускус.","Элегантный, женственный, естественный.",Яркий цветочный.,/common/img/uploaded/product/big/2012/02/24/CK0167847.jpg
262,"Аромат Lady Castagnette in White рассказывает нам историю целомудренной красавицы, которая обитает в безукоризненно белом, спокойном и невозмутимом мире.","У нее бледно-розовая кожа безупречного тона, как у фарфоровой куклы, и белое шелковое платье с драпировками.",В ее волосах сверкает бриллиантовая диадема.,"Легкий бриз дует на ее платье, мягко поднимая волосы, они переливаются, как алмазы.",Время остановило их движение.,"Свет стал волшебным, мир озарен прекрасным серебристым сиянием.","Ее аромат растворен в воздухе, создавая вокруг нее ауру благополучия.",Изысканные манеры и пленительная женственность.,Ее аромат – Lady Castagnette in White.,"Лимон, груша, мята, жасмин, персик.",Нежный. Прозрачный. Свежий.,Цветочно-фруктовый.,/common/img/uploaded/product/big/2011/12/29/LULCAT043.jpg
263,Верхние ноты аромата сверкают свежестью мандарина.  За цветочной лёгкой и утончённой нежностью лепестков сердца раскрываются мягкие обволакивающие ноты шлейфа.,"Аромат, утончённо передающий  игру цветочной гармонии.","ЧИСТЫЙ, СВЕРКАЮЩИЙ И ТОНКИЙ аромат.","Лилия, мандарин, лепестки розы, белое дерево.","Искрящийся, нежный, чистый.",Древесно-цветочный.,/common/img/uploaded/productImageFolder/ISS168066LG.jpg
264,"Яркие свежие ноты красного апельсина и имбиря, нежные и женственные ноты жасмина и цветов апельсина, чувственность древесных аккордов и сладость ванили... Все это новый аромат Armani Code, аромат тайны и соблазна...","Красный апельсин, имбирь, груша, жасмин, цветок апельсина, ваниль, древесные аккорды.","Свежий, сексуальный, женственный.",Цветочно-восточный.,/common/img/uploaded/product/EC5010970_250.jpg
265,"Сияющий, яркий и многогранный аромат J'adore - это воплощение женственности и чувственности. Роскошь орхидеи, бархатистость дамасской сливы, теплота лесного амаранта...","Мандарин, цветы чампака, плющ, орхидея, роза, фиалка, дамасская слива, лесной амарант, мускус.","Уверенный, чувственный, женственный.",Яркий цветочный.,/common/img/uploaded/product/big/2007/06/08/CHRISTIAN_DIOR_Jadore_F71524009.jpeg
266,"Аромат нового уровня чувственности, Pure Poison, создан на основе роскошного букета белых цветов и освежающего янтаря. Сила Pure Poison раскрывается постепенно: сначала цветочные нотки манят своей нежностью и чистотой, потом на сцену выходят древесно-янтарные мотивы, и только в заключительном акте появляется соблазнительный мускус.","Сладкий апельсин, бергамот, мандарин, цветы апельсина, жасмин, гардения, сандал, белый янтарь, мускус.","Блестящий, выразительный, чувственный.",Цветочно-восточный.,/common/img/uploaded/product/big/2012/01/28/F08321609.jpg
267,Название этого удивительно женственного и элегантного аромата говорит само за себя: Dolce Vita… Аромат грез и фантазий... Аромат женщины...,"Лилия, магнолия, роза, абрикос, персик, корица, сандал, гелиотроп, ваниль.","Теплый, элегантный, женственный.",Древесно-восточный.,/common/img/products/F61021009.jpg
268,"Утонченный и привлекательный Jasmin Noir – последнее поступление в коллекции классических ароматов от Bulgari. Он открывает новую главу в книге гламурной парфюмерии, предлагая современную интерпретацию одного из самых любимых и востребованных ароматов: цветка жасмина. Jasmin Noir, или черный жасмин, – цветок, разжигающий воображение. Белоснежный, трепетный, миниатюрный, в сумерках он «дышит» теплом и чувственностью, открывая свою таинственную гипнотическую душу. Jasmin Noir превращает двойственность этого изысканного цветка в метафору: цветок чистой тайны.","Жасмин, древесный аккорд, гардения, лакрица, миндаль, бобы тонка.","Чувственный, проникновенный, элегантный.",Яркий цветочный.,/common/img/uploaded/product/big/2010/03/04/BVL082271.jpg
