123,"Blumarine Bellissima Parfum Intense: чувственная и глубокая интерпретация женственности. Всего несколько капель, чтобы почувствовать себя привлекательнее, более женственной и чувственной... абсолютно великолепной. Bellissima. Для динамичной и обворожительной женщины, способной по-своему, неповторимо выразить свою чувственность, пленяя естественной и лёгкой грацией. Эссенция превосходной красоты - женственная, безошибочная, пьянящая. Blumarine Bellissima Parfum Intense - это гармония ароматов, олицетворяющая очарование, женственность, обольщение.","Имбирь, апельсин, грейпфрут, пион, страстоцвет, цветки подсолнечника, кашмеран, сандал, ванильная орхидея, мускус, ваниль, гелиотроп.","Привлекательный, женственный, чувственный.",Цветочно-восточный.,/common/img/uploaded/product/big/2010/12/22/BLM_4C001.jpg
124,"Samsara - это восхищение женщиной, ее чувственностью и страстью, благородством и щедростью. Утонченный восточный аромат удивительно гармоничен и романтичен. Ноты жасмина и сандала, окутанные бархатистой ванилью, создают ощущение тепла и чарующей безмятежности.","Жасмин, сандал, роза, нарцисс, ваниль.","Гармоничный, женственный, роскошный.",Древесный пряный.,/common/img/products/EGUE25825LG.jpg
125,"В сентябре 2010 года мир парфюмерии пополнился роскошным и чарующим ароматом Guilty от Gucci. Соблазнительный коктейль из нот мандарина и персика, сирени и герани, пачули, амбры и розового перца был создан специально для ярких, чувственных и уверенных в себе красавиц. Guilty – постоянный гость лучших вечеринок и презентаций, верный спутник самых известных леди. Рецепт восхитительного коктейля Guilty компания Gucci держит в строжайшей тайне.","Мандарин, персик, сирень, герань, пачули, розовый перец, амбра.","Яркий, соблазнительный, роскошный.",Яркий цветочный.,/common/img/uploaded/product/big/2010/09/30/GUC183429-0.jpg
126,"Для молодых и жизнерадостных девушек и женщин Cacharel создал яркий и чувственный аромат Amor Amor, аромат любви и страсти, соблазна и очарования. Восхитительный цветочно-фруктовый коктейль покоряет сердца, наполняя их романтикой и любовью.","Ландыш, бобы тонка, сандал, ваниль, мускус, мандарин, бергамот, роза, жасмин, апельсин, грейпфрут, амбра, черная смородина.","Соблазнительный, чувственный, романтичный.",Цветочно-восточный.,/common/img/products/EC3063680.jpg
127,"Для тех, кто умеет летать... Удивительно легкий, женственный и чарующий аромат Natural Vitality создан наполнить Вас радостью, оптимизмом, подарить Вам ощущение полета. Его свежая композиция создана нотами личи и красного яблока, апельсина и арбуза, листьев томата и сандала. Natural Vitality - подарите себе крылья!","Личи, красное яблоко, апельсин, листья томата, османтус, лотос, арбуз, сандал, мускус.","Легкий, свежий, женственный.",Цветочно-фруктовый.,/common/img/products/ADS800020.jpg
128,,"Малина, черная смородина, слива, роза, жасмин, лилия, иланг-иланг, персик, кедр, сандаловое дерево, мускус, дубовый мох.",Фруктово-цветочный.,/common/img/products/ELOR43571.jpg
129,,"Персик, грейпфрут, черная смородина, бергамот, роза, жасмин, иланг-иланг, абрикос, кедр, пачули, мускус.",Фруктово-цветочный.,/common/img/products/ELOR43564.jpg
130,"Лёгкие фруктово-цветочные тона, в сочетании с бергамотом и ветивером подчеркнут изысканность и элегантность ее обладательницы.","Бергамот, зеленый чай, грейпфрут, черная смородина, фрезия, водяная лилия, ландыш, персик, абрикос, жасмин, кедр, амбра.",Цветочно-фруктовый.,/common/img/products/ELOR42727.jpg
131,"Аромат Feerie от Van Cleef & Arpels привносит в мир «высокой» парфюмерии волшебство. Van Cleef & Arpels создает уникальную концепцию изысканных ароматов и превращает свой новый аромат в произведение искусства.Хранительница прекрасного ювелирного дома Van Cleef & Arpels – маленькая добрая фея. Она, как никто другой, олицетворяет поэтический мир роскошной жизни. Сегодня она вступает в королевство изысканных ароматов, чтобы воплотить фантастически свободную, творческую и изысканную женственность.","Фиалка, черная смородина, мандарин, болгарская роза, жасмин, ирис, ветивер.","Изысканный, праздничный, элегантный.",Цветочно-восточный.,/common/img/uploaded/product/big/2009/11/12/VCA008A01.jpg
132,"Для молодых, дерзких и соблазнительных! Аромат радости и веселья. Аромат, с которым начинается новая жизнь — жизнь-праздник, жизнь-сказка. Искрящиеся цитрусовые ноты гармонично дополняются кисло-сладкими ягодными нотами малины, ежевики и цветочной нежностью пиона и фрезии. LANVIN Jeanne — идеальный способ наполнить свою жизнь красками и светом!","Пион, малина, ежевика, фрезия, цитрусовый аккорд, груша, сандал, мускус, амбра.","Соблазнительный, дерзкий, романтичный.",Яркий цветочный.,/common/img/products/LNV002A02.jpg
133,"INTENSE – магическая смесь утонченных сильных ароматов, которым невозможно противостоять. Тонкие ноты нероли и зеленого мандарина уступают место изобильному и интригующему контрасту двух благородных белых цветов, апельсинового дерева и туберозы. Аромат, наполненный яркой полноценной женской сущностью, заставляет оборачиваться и интригует. Насыщенный и сильный шлейф не оставляет шансов. Ноты теплого смолистого сандалового дерева и чувственного мускуса, смешиваются с густой страстью пастилы, и этому пленительному чувственному союзуневозможно противостоять.","Мандарин, цветок апельсина, тубероза, сандал, нероли, мускус.","Благородный, женственный, утонченный.",Цветочно-восточный.,/common/img/uploaded/productImageFolder/DGB438820.jpg
134,"Связь между ароматом и воспоминанием хорошо изучена. Один намек на знакомую ноту тотчас переносит вас в запомнившийся момент. Соблазнительность каждой женщины раскрывается благодаря сладким нотам аромата. Стойкие, насыщенные, изысканные – они оставляют незабываемое впечатление.","Аромат Christina Aguilera Unforgettable открывается неотразимыми нотами сливы и граната. Чувственные ноты, передающие истинную женственность.","Сердце аромата источает ноты благородного букета цветов, один из которых – уникальный жасмин, цветущий только ночью, который также называют «королевой ночи». Базовый аккорд раскрывается самой женственной нотой – турецкой розы.  Этот компонент настолько ценный, что из 60 тысяч собранных ранним утром нежных цветов получается всего одна унция розового масла.","Шлейф аромата Unforgettable запоминается эксклюзивной нотой кашмерана – соединением, известным своим качеством оставлять незабываемое ароматическое впечатление. Композицию завершают чувственные ноты ванили, углубленные насыщенным ароматом бобов тонка – эссенции, придающей облику неотразимую чувственность и привлекательность.","Гранат, роза, кашмеран, слива, жасмин, ваниль, бобы тонка.","Соблазнительный, женственный, чувственный.",Цветочно-восточный.,/common/img/uploaded/productImageFolder/AGI439586LG.jpg
135,"Аромат страсти и нежности, дерзкий и чувственный Black XS for Her приоткрывает завесу тайны женской привлекательности и неповторимости. Роскошная роза, кокетливая фиалка и сладкая ваниль создают основу аромата, привлекают внимание и очаровывают. Ноты пачули и какао вместе с древесным аккордом наполняют композицию глубиной и соблазнительностью, перед которыми невозможно устоять.","Роза, фиалка, ваниль, пачули, какао, древесный аккорд.","Мистический, страстный, дерзкий.",Цветочно-восточный.,/common/img/uploaded/product/big/2008/12/18/PAC361601.jpg
136,"Легкая, цветочно-фруктовая вариация классического аромата Brit понравится чувственным, эмоциональным и элегантным женщинам. Обладательница Brit Sheer нежна и изящна, но вместе с тем уверена в себе и своих силах. Она оригинальна и неповторима. Ее обаяние покоряет мужские сердца. Она с оптимизмом смотрит в будущее, всегда достигает поставленные цели и остается романтиком в душе.","Мандарин, личи, юзу, листья ананаса, пион, цветок персика, японская груша, виноград, душистый горошек, белый мускус.","Элегантный, женственный, эмоциональный.",Цветочно-восточный.,/common/img/products/EBUR04A02.jpg
137,"Чувственный и соблазнительный BEYONCE Midnight Heat очаровывает восхитительным и таинственным букетом цветочных нот. В его сердце звучат и изысканная орхидея, и роскошный пион, и нежный тюльпан. Ноты сладкого и ночного кактусов привносят в композицию экзотичность, а ноты спелой сливы и карамболы – свежесть и яркость. Шлейф BEYONCE Midnight Heat соткан из теплых и чувственных нот пачули, сандала и амбры.","Орхидея, карамбола, сладкий кактус, тюльпан, пачули, эхиноцереус, слива, амбра, сандал, пион.","Соблазнительный, нежный, чувственный.",Цветочно-восточный.,/common/img/uploaded/productImageFolder/BYO901000LG.jpg
138,Описание отсутствует,/common/img/uploaded/productImageFolder/ELOR46770LG.jpg
139,"Элегантный и чувственный Terres Aromatiques 1905 из коллекции ароматов Noir Premier от Lalique напоминает нам про год, в который встретились Франсуа Коти и Рене Лалик. Эта встреча оказалась судьбоносной, ведь именно после нее появились на свет прекрасные парфюмерные творения в невероятно прекрасных и удивительных флаконах.","Композиция Lalique Terres Aromatiques 1905 Noir Premier Eau de Parfum, представленная нотами кардамона, лимона, ананаса, лаванды, тимьяна, фрезии, ветивера, бобов тонка и молекулы Orcanox, звучит невероятно элегантно и чувственно.","Коллекция ароматов Noir Premier от Lalique призвана связать прошлое и настоящее этого Дома моды. Lalique всегда чтил свою историю и традиции, и эта парфюмерная линейка стала данью уважения искусству Рене Лалика, творения которого по праву стали символами красоты для многих поколений.","Ананас, кардамон, лимон, лаванда, молекула Orcanox, ветивер, тимьян, фрезия, бобы тонка.","Элегантный, чарующий, чувственный.",Древесно-восточный.,/common/img/uploaded/productImageFolder/LLQXB1220LG.jpg
140,"Absolute Woman – это игривый женский аромат, раскрывающий две грани истинной женщины: всем привычный образ милой скромницы и противоположный ему образ дерзкой соблазнительницы. Верхние ноты аромата открываются розовым грейпфрутом, демонстрируя фруктовую композицию аромата. Но это еще не все: нотки пряного розового перца добавляют аромату неожиданные аккорды, открывая загадочную и запретную фруктово-цветочного сторону. Аромат завершают верхние ноты аппетитной сахарной амбры и ванили, которые позволяют своей обладательнице чувствовать себя раскованно. Попробуй этот взрывной микс – и ты увидишь магию перевоплощения в действии.","Пачули, жасмин, розовый грейпфрут, амбра, розовый перец, ваниль.","Соблазнительный, провокационный, озорной.",Цветочно-шипровый.,/common/img/uploaded/productImageFolder/BRU451023LG.jpg
141,"See by Chloe Si Belle – современная и яркая, трогательная и бескомпромиссная женская цветочная ароматическая композиция от известного французского модного дома Chloe.
See by Chloe Si Belle  - аромат обладающий невероятной легкостью и женственностью.
Аромат дарит пряный, чуть сладковатый аромат нероли и утонченную свежесть березового листа. Терпковато-медовый аромат цветов апельсинового дерева сплетает в одном аккорде с теплым, дурманящим запахом белоснежной гардении. Роскошным обрамлением композиции служит нежный, волнующий аромат белого мускуса – легкий и почти волшебный, он завершает звучание парфюма, медленно растворяясь в пространстве.","Нероли, белый мускус, береза, гардения, флердоранж.","Соблазнительный, женственный, современный.",Яркий цветочный.,/common/img/products/3607341410566.jpg
142,"В ярком и стильном Flower Tag звучит мелодия мегаполиса, его шум, суета и… очарование! Каждая нота аромата привлекает внимание, словно ей досталось право стать акцентом композиции. Но все они вместе звучат так слажено и гармонично, что с первых аккордов очаровывают и увлекают за собой. Flower Tag создан для современных девушек, чтобы вместе с ними гулять по людным улицам, приковывая к себе восхищенные взгляды прохожих.","Ревень, жасмин, мандарин, чай, черная смородина, ванильный мускус, ландыш, пион.","Яркий, современный, свободный.",Цветочно-фруктовый.,/common/img/uploaded/product/big/2011/09/01/KEN164200.jpg
143,"Откройте для себя Miss Dior Blooming Bouquet - цветочную и нежную версию аромата Miss Dior. Этот аромат Высокой Моды от Dior создан для юных элегантных девушек. Его изысканный цветочный букет таит в своем сердце аккорды пиона. Распускаясь переливающимися фруктовыми нотами, он оставляет прикосновение свежести и элегантности с оттенком легкой дерзости.",Нежный цветочный.,/common/img/products/F03262488.jpg
144,"Яркий и чарующий аромат для современных леди, в душе которых гармонично уживается строгая элегантность и кокетливое безрассудство. Композиция аромата Lady Castagnette представлена ягодно-фруктовым аккордом, сотканным из персика, черной смородины и ежевики, нежными нотами розы и жасмина, согретыми сладостью ванили и чувственностью кедра и мускуса.","Персик, черная смородина, ежевика, жасмин, роза, фиалка, сандал, ваниль, мускус.","Женственный, чарующий, яркий.",Яркий цветочный.,/common/img/uploaded/product/big/2011/03/17/LULCAT048.jpg
145,"Мистерия чувств. Рождение звезды! Гармония элегантности и непосредственности. Парфюмерная вода Very Irresistible создана для тех, кто не боится стать центром внимания. Завораживающая утонченность цветочных нот и сладость ванили дополнена яркостью пачули.","Болгарская роза, пион, листья вербены, анис, ваниль, пачули.","Яркий, блестящий, очаровательный.",Яркий цветочный.,/common/img/products/GIV035336.jpg
146,"Нежный и элегантный DOLCE&GABBANA Dolce подобен изысканному и неповторимому дизайнерскому наряду, в котором каждая деталь, каждая мелочь точно выверены и идеально выполнены. В композиции аромата каждая нота звучит ярко и красиво и вместе с тем не нарушает общей гармонии, безупречно сочетаясь с окружающими ее аккордами. DOLCE&GABBANA Dolce – гимн женственности и изящности.",Покоряющий плавностью своих линий флакон выполнен из прозрачного стекла и увенчан стильным «марципановым цветком» – визитной карточкой лучших сицилийских кондитеров.,"Кашемир, нероли, мускус, цветок папайи, амариллис, кувшинка, нарцисс.","Элегантный, женственный, нежный.",Яркий цветочный.,/common/img/uploaded/productImageFolder/DGB440678LG.jpg
147,"Элегантность всегда была определяющей характеристикой стиля SALVATORE FERRAGAMO. Исполненные грации и изысканности произведения этого флорентийского бренда славятся во всем мире своим безупречным вкусом. Отдавая дань элегантности, Salvatore Ferragamo представляет роскошный аромат Signorina Eleganza, который воспевает женственность, грациозность и соблазнительность.","Упаковка аромата Signorina Eleganza, выполненная в бежевой палитре, передает очарование деликатной элегантности. Золотистый логотип Eleganza и золотистое основание с рельефной гравировкой дарят дизайну флакона оттенок великолепия и совершенства. Флакон украшает знаменитый бант из тесьмы, на этот раз двух оттенков бежевого цвета.","Миндаль, кожа, пачули, груша, османтус, грейпфрут.","Женственный, изысканный, элегантный.",Цветочно-восточный.,/common/img/uploaded/productImageFolder/FER041052LG.jpg
